Link Name,Center of Mass X,Center of Mass Y,Center of Mass Z,Center of Mass Roll,Center of Mass Pitch,Center of Mass Yaw,Mass,Moment Ixx,Moment Ixy,Moment Ixz,Moment Iyy,Moment Iyz,Moment Izz,Visual X,Visual Y,Visual Z,Visual Roll,Visual Pitch,Visual Yaw,Mesh Filename,Color Red,Color Green,Color Blue,Color Alpha,Collision X,Collision Y,Collision Z,Collision Roll,Collision Pitch,Collision Yaw,Collision Mesh Filename,Material Name,SW Components,Coordinate System,Axis Name,Joint Name,Joint Type,Joint Origin X,Joint Origin Y,Joint Origin Z,Joint Origin Roll,Joint Origin Pitch,Joint Origin Yaw,Parent,Joint Axis X,Joint Axis Y,Joint Axis Z,Limit Effort,Limit Velocity,Limit Lower,Limit Upper,Calibration rising,Calibration falling,Dynamics Damping,Dynamics Friction,Safety Soft Upper,Safety Soft Lower,Safety K Position,Safety K Velocity
base_link,1.12169088699127,-0.121140693558929,-0.213529355221054,0,0,0,4.50779680589233,0.0155744669511241,0.000267312829592054,-0.000921990975110573,0.0123110151558508,0.00166823235851846,0.0144138530523192,0,0,0,0,0,0,package://ARM YPR GRIPPER_7/meshes/base_link.STL,0.792156862745098,0.819607843137255,0.933333333333333,1,0,0,0,0,0,0,package://ARM YPR GRIPPER_7/meshes/base_link.STL,,CHASSIS R25-1;RMCS 2019 GEAR BOX WITH 1006 MOTOR (1)-4;motor holder for turntable-1;linear actuator_stroke-2;linear actuator_body-1;thrust bearing-1,Origin_global,,,,0,0,0,0,0,0,,0,0,0,,,,,,,,,,,,
turntable,0.105763980678447,-0.00089189198876527,-0.0260116131683339,0,0,0,2.52870378509003,0.00641134887101375,0.000853146367351283,-9.61006870504373E-06,0.00486617833905661,2.16935043543991E-05,0.00929271252291498,0,0,0,0,0,0,package://ARM YPR GRIPPER_7/meshes/turntable.STL,0.650980392156863,0.619607843137255,0.588235294117647,1,0,0,0,0,0,0,package://ARM YPR GRIPPER_7/meshes/turntable.STL,,ratu_bhai_ka_gear[1]-1;TT ROD-1;TT BASE( NEEDS TO BE WELDED) ON WHICH TT U PLATE WILL BE BOLTED-1;arm base blate-1;RMCS 2019 GEAR BOX WITH 1006 MOTOR (1)-3;motor holder for 180 kgcm-1;worm gear sup-1;support part for worm gear-3;bearing for arm (32-20-7)-2;worm gear sup 2-1;bearing for arm (32-20-7)-1;support bearing for worm gear (26-10-8)-3,Origin_turntable_joint,Axis5,turntable_joint,revolute,1.35000046806038,-0.216,-0.311161541452805,1.5707963267949,-1.15332436277035,3.14159265358979,base_link,0,0,-1,0,0,0,0,,,,,,,,
worm_pitch,-0.00975815373258329,-0.119432998209141,0.138678111763514,0,0,0,3.22088245146173,0.0280751971325729,-3.59522261295656E-08,-5.70039309070443E-07,0.0158829956773457,0.0120530236922504,0.0134222737428643,0,0,0,0,0,0,package://ARM YPR GRIPPER_7/meshes/worm_pitch.STL,0.792156862745098,0.819607843137255,0.933333333333333,1,0,0,0,0,0,0,package://ARM YPR GRIPPER_7/meshes/worm_pitch.STL,,worm n worm wheel-2;lower arm 1(gear coupling)-6;lower arm 1(gear coupling)-7;worm n worm wheel second linkmotor-3;connection part to be welded on both link-1;MOTOR SHAFT FOR PULLEY WORM GEAR-1;driving pulley-1;driven belt pulley-1/driven pulley-1;BEARING HOLDER FOR UPPER LINK-2;BEARING HOLDER FOR UPPER LINK-1;SHAFT FOR LOWER LINK-1,Origin_pitch1_joint,Axis6,pitch1_joint,revolute,0.0735164068372525,0.077745638479509,-0.151720000000009,1.5707963267949,0,0.417471964024542,turntable,-1,0,0,0,0,0,0,,,,,,,,
pulley,-0.067342566624464,-0.0631791995553346,-0.0419109788002336,0,0,0,1.78809248147294,0.00213333923198405,-0.000867369411845703,1.95378069418704E-06,0.0022216968306464,-2.218237233129E-06,0.00323857402349486,0,0,0,0,0,0,package://ARM YPR GRIPPER_7/meshes/pulley.STL,0.898039215686275,0.917647058823529,0.929411764705882,1,0,0,0,0,0,0,package://ARM YPR GRIPPER_7/meshes/pulley.STL,,driven belt pulley-1/driven pulley-1;driven belt pulley-1/driven belt covering ring-1;driven belt pulley-1/driven belt covering ring-2;SHAFT FOR UPPER LINK-1;polypropylene flange for upper link-1;polypropylene flange for upper link-2;UPPER LINK-1;UPPER LINK-2;ypr connector-1;yr vertical 2 piece-2;yr vertical 2 piece-1;difff.-1/motor mount and link L-5;difff.-1/motor mount and link-1;difff.-1/turntable_motor_60kgcm_stepper-2;difff.-1/turntable_motor_60kgcm_stepper-3;difff.-1/motor mount and link L-4;difff.-1/small pulley-1;difff.-1/small pulley-2;difff.-1/belt-2;difff.-1/belt-3,Origin_pitch2_joint,Axis7,pitch2_joint,revolute,-0.06,-0.28998,0.3107,1.5708,-1.3747,-1.5708,worm_pitch,0,0,-1,0,0,0,0,,,,,,,,
pitch,0.0621093053463832,0.134911342325096,0.00321851094996328,0,0,0,0.925309423783586,0.000905421686824765,5.34409864880228E-05,-0.000133446110442722,0.000840392256623591,1.72313152784089E-05,0.00123723911311522,0,0,0,0,0,0,package://ARM YPR GRIPPER_7/meshes/pitch.STL,0.792156862745098,0.819607843137255,0.933333333333333,1,0,0,0,0,0,0,package://ARM YPR GRIPPER_7/meshes/pitch.STL,,difff.-1/diff C section-1;difff.-1/straight bevel pinion_am-5;difff.-1/bevel pinion shaft-2;difff.-1/straight bevel pinion_am-6;difff.-1/bevel pinion shaft-1;difff.-1/bevel gear shaft-1;difff.-1/straight bevel gear_am-2;difff.-1/diff C section I part-1;difff.-1/15-32-9 bearing holder-1;difff.-1/diff to gripper-1;Gripper YPR Connection-1;diff C section-1;difff.-1/44T 5M PULLEY-2;difff.-1/44T 5M PULLEY-1;gripper updated_51-1/gripper updated_5.STEP-1/FRAME 3(ALL).STEP-1;gripper updated_51-1/gripper updated_5.STEP-1/LEAD 8MM (ALL).STEP-1;gripper updated_51-1/gripper updated_5.STEP-1/GUIDE ROD 8mm (ALL).STEP-1;gripper updated_51-1/gripper updated_5.STEP-1/motor mount GRIPPER ALL.STEP-1;gripper updated_51-1/gripper updated_5.STEP-1/CLAW(ALL).STEP-1;gripper updated_51-1/gripper updated_5.STEP-1/frame griper.STEP-1;gripper updated_51-1/gripper updated_5.STEP-1/GRIPPER ALL MOTOR.STEP-1;gripper updated_51-1/gripper updated_5.STEP-1/limit switch.STEP-1;gripper updated_51-1/gripper updated_5.STEP-1/linear act sample model(ALL).STEP-1,Origin_ypr_pitch_joint,Axis8,ypr_pitch_joint,revolute,-0.19051,-0.17768,-0.112,0.90468,-1.5708,0,pulley,-1,0,0,0,0,0,0,,,,,,,,
roll,0.00820967914203474,-0.00829727339334974,-0.0741025510125426,0,0,0,0.822174268776543,0.000957891470934724,0.000221680605326053,-3.9340990708054E-05,0.000959787814957132,4.00432863294902E-05,0.000768380332969696,0,0,0,0,0,0,package://ARM YPR GRIPPER_7/meshes/roll.STL,0.792156862745098,0.819607843137255,0.933333333333333,1,0,0,0,0,0,0,package://ARM YPR GRIPPER_7/meshes/roll.STL,,difff.-1/bevel gear shaft-1;difff.-1/straight bevel gear_am-2;difff.-1/straight bevel pinion_am-5;difff.-1/straight bevel pinion_am-6;difff.-1/bevel pinion shaft-1;difff.-1/44T 5M PULLEY-1;difff.-1/bevel pinion shaft-2;difff.-1/44T 5M PULLEY-2;difff.-1/diff to gripper-1;Gripper YPR Connection-1;gripper updated_51-1/gripper updated_5.STEP-1/CLAW(ALL).STEP-1;gripper updated_51-1/gripper updated_5.STEP-1/FRAME 3(ALL).STEP-1;gripper updated_51-1/gripper updated_5.STEP-1/frame griper.STEP-1;gripper updated_51-1/gripper updated_5.STEP-1/LEAD 8MM (ALL).STEP-1;gripper updated_51-1/gripper updated_5.STEP-1/GUIDE ROD 8mm (ALL).STEP-1;gripper updated_51-1/gripper updated_5.STEP-1/motor mount GRIPPER ALL.STEP-1;gripper updated_51-1/gripper updated_5.STEP-1/GRIPPER ALL MOTOR.STEP-1;gripper updated_51-1/gripper updated_5.STEP-1/limit switch.STEP-1;gripper updated_51-1/gripper updated_5.STEP-1/linear act sample model(ALL).STEP-1,Origin_roll2,Axis9,roll,continuous,0.05225,0.069756,0,1.5708,-1.1062,0,pitch,0,0,-1,0,0,0,0,,,,,,,,
grip,-0.0264212696817925,6.99440505513849E-15,0.0519403659924383,0,0,0,0.134543517946272,5.22930570804675E-05,1.78215732102305E-18,-2.24360153272595E-06,0.000148952960809367,5.42101086242752E-20,0.000126256855074672,0,0,0,0,0,0,package://ARM YPR GRIPPER_7/meshes/grip.STL,0.792156862745098,0.819607843137255,0.933333333333333,1,0,0,0,0,0,0,package://ARM YPR GRIPPER_7/meshes/grip.STL,,gripper updated_51-1/gripper updated_5.STEP-1/GRIPPER ALL MOTOR.STEP-1;gripper updated_51-1/gripper updated_5.STEP-1/CLAW(ALL).STEP-1;gripper updated_51-1/gripper updated_5.STEP-1/LEAD 8MM (ALL).STEP-1,Origin_grip,Axis10,grip,prismatic,0.086479,-0.086479,-0.11021,2.3562,-1.5708,0,roll,0,0,-1,0,0,0,0,,,,,,,,
